{"baseline_sha":"66495a2a22cd0a57efcc4f721e65532f0987b4e8","digests":{"inventory_digest":"sha256:0cb94baa9f6684346d361942804c4289fb373c32fa4f16e03f0bdc7c1af562ac","profile_schema_digest":"sha256:5cd679e5a8cc6e8009d5511adf4a0720d33b3e705affc35b935d6913d7a80ebe"},"inventory":[{"classification":"Semantic","inventory_id":"session.create","method":"POST","normalized_path":"/session","status":"Verified","transport":"HTTP","upstream_operation_id":"session.create"},{"classification":"Unsupported","inventory_id":"session.prompt","method":"POST","normalized_path":"/session/:sessionID/message","status":"Planned","transport":"HTTP","upstream_operation_id":"session.prompt"},{"classification":"Unsupported","inventory_id":"session.prompt_async","method":"POST","normalized_path":"/session/:sessionID/prompt_async","status":"Planned","transport":"HTTP","upstream_operation_id":"session.prompt_async"},{"classification":"Unsupported","inventory_id":"session.status","method":"GET","normalized_path":"/session/status","status":"Planned","transport":"HTTP","upstream_operation_id":"session.status"},{"classification":"Unsupported","inventory_id":"session.abort","method":"POST","normalized_path":"/session/:sessionID/abort","status":"Planned","transport":"HTTP","upstream_operation_id":"session.abort"},{"classification":"Unsupported","inventory_id":"event.stream","method":"GET","normalized_path":"/session/:sessionID/events","status":"Planned","transport":"HTTP","upstream_operation_id":"event.stream"},{"classification":"Unsupported","inventory_id":"permission.request","method":"POST","normalized_path":"/session/:sessionID/permission","status":"Planned","transport":"HTTP","upstream_operation_id":"permission.request"},{"classification":"Unsupported","inventory_id":"permission.respond","method":"POST","normalized_path":"/session/:sessionID/permission/:permissionID/respond","status":"Planned","transport":"HTTP","upstream_operation_id":"permission.respond"}],"profile_id":"opencode-baseline-inventory","profile_revision":2}